{
  "$schema": "https://json-schema.org/draft/2020-12/schema",
  "$id": "urn:insight:productization:scenario-report:v1",
  "title": "Insight Productization Golden Scenario Report",
  "type": "object",
  "additionalProperties": false,
  "required": [
    "schema_version",
    "report_kind",
    "scenario_id",
    "contract_profile",
    "profile",
    "automation_layer",
    "source_revision",
    "environment",
    "started_at",
    "finished_at",
    "status",
    "entrypoints",
    "assertions",
    "failure_probes"
  ],
  "properties": {
    "schema_version": { "const": 1 },
    "report_kind": { "const": "insight.productization.scenario-report/v1" },
    "scenario_id": { "type": "string", "minLength": 1, "maxLength": 96 },
    "contract_profile": { "const": "insight.platform/v1" },
    "profile": {
      "enum": [
        "starter",
        "starter+context",
        "starter+mcp,remote-capability",
        "starter+model",
        "starter+remote-capability",
        "starter+remote-capability,wasi",
        "starter+wasi"
      ]
    },
    "automation_layer": { "enum": ["P2", "P3"] },
    "source_revision": {
      "type": "string",
      "pattern": "^[0-9a-f]{40}$"
    },
    "environment": {
      "type": "object",
      "additionalProperties": false,
      "required": ["os", "architecture", "fresh_profile"],
      "properties": {
        "os": { "type": "string", "minLength": 1, "maxLength": 64 },
        "architecture": { "type": "string", "minLength": 1, "maxLength": 64 },
        "fresh_profile": { "const": true }
      }
    },
    "started_at": { "type": "string", "format": "date-time" },
    "finished_at": { "type": "string", "format": "date-time" },
    "status": { "enum": ["passed", "incomplete", "failed"] },
    "entrypoints": { "$ref": "#/$defs/checks" },
    "assertions": { "$ref": "#/$defs/checks" },
    "failure_probes": { "$ref": "#/$defs/checks" }
  },
  "$defs": {
    "checks": {
      "type": "array",
      "minItems": 1,
      "items": {
        "type": "object",
        "additionalProperties": false,
        "required": ["id", "status", "evidence"],
        "properties": {
          "id": { "type": "string", "minLength": 1, "maxLength": 96 },
          "status": { "enum": ["passed", "failed", "not_run"] },
          "evidence": { "type": "string", "minLength": 1, "maxLength": 1024 }
        }
      }
    }
  }
}
