{
  "schema_version": 1,
  "report_kind": "insight.productization.scenario-report/v1",
  "scenario_id": "deterministic-first-run",
  "contract_profile": "insight.platform/v1",
  "profile": "starter",
  "automation_layer": "P2",
  "source_revision": "0000000000000000000000000000000000000000",
  "environment": {
    "os": "fixture",
    "architecture": "fixture",
    "fresh_profile": true
  },
  "started_at": "2026-08-29T00:00:00.000000Z",
  "finished_at": "2026-08-29T00:00:01.000000Z",
  "status": "incomplete",
  "entrypoints": [
    {"id": "cli", "status": "passed", "evidence": "fixture CLI evidence"},
    {"id": "http_fixture", "status": "passed", "evidence": "fixture raw HTTP evidence"},
    {"id": "console", "status": "not_run", "evidence": "fixture Console gap"}
  ],
  "assertions": [
    {"id": "run_terminal", "status": "passed", "evidence": "fixture terminal evidence"},
    {"id": "stream_replay", "status": "passed", "evidence": "fixture replay evidence"},
    {"id": "exact_binding_visible", "status": "passed", "evidence": "fixture binding evidence"}
  ],
  "failure_probes": [
    {"id": "invalid_receipt_conflict", "status": "passed", "evidence": "fixture Receipt conflict evidence"},
    {"id": "gateway_unavailable", "status": "passed", "evidence": "fixture Gateway diagnostic evidence"}
  ]
}
